{"source_id":"steam-store","generated":"2026-10-30","source":"Steam's store (api.steampowered.com): ISteamChartsService/GetMostPlayedGames","license":"Steam's terms of use (Valve)","items":{"730":1,"570":2,"578080":3,"431960":4,"4115450":5,"1422450":6,"1938090":7,"1091500":8,"1172470":9,"271590":10,"3393110":11,"2676230":12,"381210":13,"2868840":14,"236390":15,"1867240":16,"322170":17,"359550":18,"2357570":19,"1973530":20,"250900":21,"553850":22,"230410":23,"252490":24,"413150":25,"1808500":26,"2767030":27,"892970":28,"440":29,"3241660":30,"3240220":31,"105600":32,"2807960":33,"2507950":34,"322330":35,"550":36,"227300":37,"4348910":38,"284160":39,"4126040":40,"5335510":41,"1203620":42,"438100":43,"4080220":44,"108600":45,"292030":46,"394360":47,"3405690":48,"1203220":49,"1174180":50,"252950":51,"1086940":52,"4000":53,"1665460":54,"1142710":55,"1449850":56,"2483190":57,"489830":58,"3419430":59,"1905180":60,"1364780":61,"1623730":62,"3678970":63,"221100":64,"1304930":65,"2300320":66,"3527290":67,"1245620":68,"2073850":69,"1281930":70,"1222670":71,"2073620":72,"294100":73,"289070":74,"1366800":75,"291550":76,"1085660":77,"3513350":78,"739630":79,"244210":80,"2246340":81,"714010":82,"2139460":83,"4019220":84,"261550":85,"813780":86,"251570":87,"594650":88,"3259780":89,"2183900":90,"4162040":91,"632360":92,"3932890":93,"960090":94,"275850":95,"2050650":96,"1326470":97,"2379780":98,"3224770":99,"1329410":100},"schema":1}
